{
 "schemaVersion": "planeon.review-identity/v2",
 "record": {
  "path": "architecture/linux-root-aliases/review-round2.json",
  "sha256": "f09b270ac2371e9b4e2514002af448917c11341ff4fcf2b82af4802e375241ed"
 },
 "reviewer": {
  "agentId": "a8626ed5da603fd28",
  "agentType": "general-purpose subagent of the parallel lane session",
  "model": "claude-opus-5-5"
 },
 "operator": {
  "role": "LANE_SESSION",
  "agentId": "dd0addca-4e18-4222-9017-955f02d00b0d",
  "lane": "parallel"
 },
 "author": {
  "agentIds": [
   "dd0addca-4e18-4222-9017-955f02d00b0d",
   "a6b35348089f1ad0d"
  ]
 },
 "briefSha256": "1f09d23451bf265e32e44742ca362dabf5a1090c2208c1349cbf491670798aec",
 "rulesSha256": "9e933487c6327350c201d8b2f16a121a97e885601ca067c0704b46add567d794",
 "wrapperSha256": "9d73af49a30bc6ee76503979a2720159c06fec9885139ff4cdb37967eae1ee90",
 "subject": {
  "repository": "harness-onion",
  "commit": "49180b884e753086f7d23da90c2e01145c04c39b",
  "tree": "8c6c82d0d4dbf02180a247b62d880704a8f1554f"
 },
 "base": {
  "repository": "harness-onion",
  "commit": "c83efb466977612af1c48472a088c90d08097633",
  "tree": "b72255c007e1678934ce6262142f75f87ffe2982"
 },
 "launched": "2026-10-24T17:10:17+08:00",
 "finished": "2026-10-24T17:21:12+08:00",
 "interruptions": [],
 "operatorRelays": [],
 "runs": [],
 "ruling": {
  "decision": "KEEP",
  "by": "LANE_MONITOR",
  "ref": "MON-RA-R2-KEEP",
  "date": "2026-10-24"
 }
}
