{
 "schemaVersion": "planeon.review-identity/v2",
 "record": {
  "path": "architecture/linux-probe-kit-admission/review-round1.json",
  "sha256": "3a3d8576ef34ec2bf2af6eed2c906c9cfed6120b1e688c5082083c38bf51419a"
 },
 "reviewer": {
  "agentId": "a106c0c3b6ee32ba6",
  "agentType": "general-purpose subagent of the primary lane session",
  "model": "claude-opus-5-5"
 },
 "operator": {
  "role": "LANE_SESSION",
  "agentId": "79e9a312-b1f1-4f77-b18f-691a8203f4c5",
  "lane": "primary"
 },
 "author": {
  "agentIds": [
   "79e9a312-b1f1-4f77-b18f-691a8203f4c5",
   "0bcc06ab-c4db-4ff3-b31a-80c91104b334",
   "af1427bea2d6ca96c"
  ]
 },
 "briefSha256": "1f09d23451bf265e32e44742ca362dabf5a1090c2208c1349cbf491670798aec",
 "rulesSha256": "4fd769d58bb32779ecb7799b0552c0d1a698782145e1050d8ad5689dad39ab47",
 "wrapperSha256": null,
 "subject": {
  "repository": "harness-onion",
  "commit": "329a8d96697ff4232a75f5ed801bdc7f71021969",
  "tree": "4326e00eb55fa32458a66d081814080ed597b455"
 },
 "launched": "2026-10-24T15:39:14+08:00",
 "finished": "2026-10-24T16:07:14+08:00",
 "interruptions": [
  "two prefixed commands waited in the PAUSE/HOLD loop while HOLD_BY_VERIFY was set (R10 PR #25's verify); one, a git show of an exact path, passed 120 s and the harness moved it to the background; both finished when the hold cleared, and the reviewer re-ran the background job's grep on its WORK copy instead of reading its output"
 ],
 "operatorRelays": [],
 "runs": [
  {
   "limit": "archive extractions of the subject, none allowed",
   "used": 0
  },
  {
   "limit": "commands over 120 s (the PAUSE/HOLD wait only)",
   "used": 1
  }
 ],
 "ruling": {
  "decision": "KEEP",
  "by": "LANE_MONITOR",
  "ref": "MON-LPK1-CR1-SLIPS",
  "date": "2026-10-24"
 }
}
