{
 "schemaVersion": "planeon.review-identity/v2",
 "record": {
  "path": "architecture/linux-root-aliases/review-round1.json",
  "sha256": "4abfb43fe075469076a2e36d10619c4a37b74e8f918f1c0a3348955a12b1b9df"
 },
 "reviewer": {
  "agentId": "a68759e6a2ed9c9ae",
  "agentType": "general-purpose subagent of the parallel lane session",
  "model": "claude-opus-5-5"
 },
 "operator": {
  "role": "LANE_SESSION",
  "agentId": "dd0addca-4e18-4222-9017-955f02d00b0d",
  "lane": "parallel"
 },
 "author": {
  "agentIds": [
   "dd0addca-4e18-4222-9017-955f02d00b0d",
   "a6b35348089f1ad0d"
  ]
 },
 "briefSha256": "1f09d23451bf265e32e44742ca362dabf5a1090c2208c1349cbf491670798aec",
 "rulesSha256": "cf14c3ccbfff9a21ad3df253090ff0cd23d5f6266a010ff9775dcda869a76fb3",
 "wrapperSha256": "9d73af49a30bc6ee76503979a2720159c06fec9885139ff4cdb37967eae1ee90",
 "subject": {
  "repository": "harness-onion",
  "commit": "c83efb466977612af1c48472a088c90d08097633",
  "tree": "b72255c007e1678934ce6262142f75f87ffe2982"
 },
 "launched": "2026-10-24T16:51:57+08:00",
 "finished": "2026-10-24T17:05:45+08:00",
 "interruptions": [],
 "operatorRelays": [],
 "runs": [],
 "ruling": {
  "decision": "KEEP",
  "by": "LANE_MONITOR",
  "ref": "MON-RA-R1-KEEP",
  "date": "2026-10-24"
 }
}
