{
 "schemaVersion": "planeon.review-identity/v2",
 "record": {
  "path": "architecture/policy-observation-digests-v2/review-round1.json",
  "sha256": "b25518c92858807cae84a069f85b39e6323a68c622f8aa3189282f7d153a8c4d"
 },
 "reviewer": {
  "agentId": "abf1a479db765e1da",
  "agentType": "general-purpose subagent of the primary lane session",
  "model": "claude-opus-5-5"
 },
 "operator": {
  "role": "LANE_SESSION",
  "agentId": "79e9a312-b1f1-4f77-b18f-691a8203f4c5",
  "lane": "primary"
 },
 "author": {
  "agentIds": [
   "79e9a312-b1f1-4f77-b18f-691a8203f4c5",
   "a1633b08fa51db70b"
  ]
 },
 "briefSha256": "1f09d23451bf265e32e44742ca362dabf5a1090c2208c1349cbf491670798aec",
 "rulesSha256": "e29e77d573645835ceda9e7b4175e276274160bc497f9ca22c2ab1d0237419d1",
 "wrapperSha256": null,
 "subject": {
  "repository": "harness-onion",
  "commit": "6cc40a1e31f40f73792dec7e48b687f02d2393ee",
  "tree": "0aa97c035bbdb3b076c991094ad08f7256f4968e"
 },
 "launched": "2026-10-24T23:12:30+08:00",
 "finished": "2026-10-24T23:30:02+08:00",
 "interruptions": [],
 "operatorRelays": [
  "the launch prompt told the reviewer that OWNER_DECISIONS.md had grown by MON-I01S-CR1-GO (about 133 lines, not the rules' 120) and relayed the lane monitor's request to confirm Q-C1-1 against W2's and W3's needs",
  "during the round the operator appended the lane monitor's nested-test pre-check lesson to OWNER_DECISIONS.md (MON-I01S-CR1-APPEND: noted, no effect)"
 ],
 "runs": [
  {
   "limit": "commands over 120 s",
   "used": 0
  }
 ],
 "ruling": {
  "decision": "KEEP",
  "by": "LANE_MONITOR",
  "ref": "MON-I01S-CR1-KEEP",
  "date": "2026-10-24"
 }
}
